[
  {"v":1,"id":"01JC0000000000000000000001","seq":1,"session":"01JC00000000000000000SESS1","at":"2026-10-27T12:00:00.000Z","type":"message.created","actor":{"kind":"human","id":"user-7"},"data":{"messageId":"m_01","role":"user","text":"Build the landing page from the brief."}},
  {"v":1,"id":"01JC0000000000000000000002","seq":2,"session":"01JC00000000000000000SESS1","at":"2026-10-27T12:00:00.010Z","type":"session.status","actor":{"kind":"system","id":"charlotte"},"data":{"status":"queued"}},
  {"v":1,"id":"01JC0000000000000000000003","seq":3,"session":"01JC00000000000000000SESS1","at":"2026-10-27T12:00:01.000Z","type":"run.started","actor":{"kind":"system","id":"charlotte"},"data":{"runId":"run_a1","mode":"charlotte_builder","provider":"anthropic","model":"claude-sonnet-5-5"}},
  {"v":1,"id":"01JC0000000000000000000004","seq":4,"session":"01JC00000000000000000SESS1","at":"2026-10-27T12:00:01.200Z","type":"message.delta","actor":{"kind":"agent","id":"charlotte"},"data":{"messageId":"m_02","role":"assistant","text":"Reading the brief."}},
  {"v":1,"id":"01JC0000000000000000000005","seq":5,"session":"01JC00000000000000000SESS1","at":"2026-10-27T12:00:01.300Z","type":"message.completed","actor":{"kind":"agent","id":"charlotte"},"data":{"messageId":"m_02","role":"assistant","text":"Reading the brief."}},
  {"v":1,"id":"01JC0000000000000000000006","seq":6,"session":"01JC00000000000000000SESS1","at":"2026-10-27T12:00:01.400Z","type":"tool.call","actor":{"kind":"agent","id":"charlotte"},"data":{"callId":"call_1","tool":"cms_apply","args":"{\"basedOn\":\"r0\",\"ops\":[]}","truncated":false}},
  {"v":1,"id":"01JC0000000000000000000007","seq":7,"session":"01JC00000000000000000SESS1","at":"2026-10-27T12:00:01.500Z","type":"doc.changed","actor":{"kind":"agent","id":"charlotte"},"data":{"revision":"r00000000000000000000000000000002","previousRevision":"r00000000000000000000000000000001","opCount":1,"ops":[{"t":"set_meta","patch":{"title":"Acme Ledger"}}]}},
  {"v":1,"id":"01JC0000000000000000000008","seq":8,"session":"01JC00000000000000000SESS1","at":"2026-10-27T12:00:01.600Z","type":"tool.result","actor":{"kind":"agent","id":"charlotte"},"data":{"callId":"call_1","tool":"cms_apply","ok":true,"code":null,"revision":"r00000000000000000000000000000002","summary":"{\"revision\":\"r00000000000000000000000000000002\",\"applied\":1}","truncated":false}},
  {"v":1,"id":"01JC0000000000000000000009","seq":9,"session":"01JC00000000000000000SESS1","at":"2026-10-27T12:00:02.000Z","type":"proposal.created","actor":{"kind":"agent","id":"charlotte"},"data":{"proposalId":"01JC000000000000000000PROP","baseRevision":"r00000000000000000000000000000002","revision":"r00000000000000000000000000000003","opCount":1,"ops":[{"t":"set_meta","patch":{"title":"Acme"}}]}},
  {"v":1,"id":"01JC0000000000000000000010","seq":10,"session":"01JC00000000000000000SESS1","at":"2026-10-27T12:00:02.100Z","type":"proposal.updated","actor":{"kind":"agent","id":"charlotte"},"data":{"proposalId":"01JC000000000000000000PROP","revision":"r00000000000000000000000000000004","opCount":2,"ops":[{"t":"set_meta","patch":{"slug":"/"}}]}},
  {"v":1,"id":"01JC0000000000000000000011","seq":11,"session":"01JC00000000000000000SESS1","at":"2026-10-27T12:00:03.000Z","type":"proposal.resolved","actor":{"kind":"human","id":"user-7"},"data":{"proposalId":"01JC000000000000000000PROP","state":"accepted","revision":"r00000000000000000000000000000005"}},
  {"v":1,"id":"01JC0000000000000000000012","seq":12,"session":"01JC00000000000000000SESS1","at":"2026-10-27T12:00:04.000Z","type":"checks.result","actor":{"kind":"system","id":"charlotte"},"data":{"revision":"r00000000000000000000000000000005","summary":{"errors":1,"warnings":1,"info":0},"defects":[{"code":"missing_required_fact","severity":"error","fact":"contact","message":"The page does not carry the required fact \"contact\"."},{"code":"unsupported_claim","severity":"warning","kind":"currency","claim":"$29","node":"t1","message":"The page states $29, which no brief fact supports."}],"facts":{"outline":[{"node":"h1","level":1,"text":"Acme Ledger"}],"images":[],"links":[]}}},
  {"v":1,"id":"01JC0000000000000000000013","seq":13,"session":"01JC00000000000000000SESS1","at":"2026-10-27T12:00:04.100Z","type":"draft.ready","actor":{"kind":"agent","id":"charlotte"},"data":{"revision":"r00000000000000000000000000000005"}},
  {"v":1,"id":"01JC0000000000000000000014","seq":14,"session":"01JC00000000000000000SESS1","at":"2026-10-27T12:00:05.000Z","type":"usage.observed","actor":{"kind":"system","id":"charlotte"},"data":{"provider":"anthropic","model":"claude-sonnet-5-5","inputTokens":1200,"outputTokens":340,"costUsd":null,"priced":false}},
  {"v":1,"id":"01JC0000000000000000000015","seq":15,"session":"01JC00000000000000000SESS1","at":"2026-10-27T12:00:05.100Z","type":"run.finished","actor":{"kind":"system","id":"charlotte"},"data":{"runId":"run_a1","finishReason":"stop"}},
  {"v":1,"id":"01JC0000000000000000000016","seq":16,"session":"01JC00000000000000000SESS1","at":"2026-10-27T12:00:06.000Z","type":"run.failed","actor":{"kind":"system","id":"charlotte"},"data":{"runId":"run_a2","code":"provider_error"}},
  {"v":1,"id":"01JC0000000000000000000017","seq":17,"session":"01JC00000000000000000SESS1","at":"2026-10-27T12:00:07.000Z","type":"draft.published","actor":{"kind":"human","id":"user-7"},"data":{"revision":"r00000000000000000000000000000005"}},
  {"v":1,"id":"01JC0000000000000000000018","seq":18,"session":"01JC00000000000000000SESS1","at":"2026-10-27T12:00:08.000Z","type":"error","actor":{"kind":"system","id":"charlotte"},"data":{"code":"turn_in_progress","message":"A turn is already running for this session."}}
]
